<?xml version="1.0" encoding="UTF-8"?>
<!DOCTYPE trabajo_etapa_vuelta SYSTEM "etapa.dtd">
<trabajo_etapa_vuelta>
    <!-- Identificación general de la etapa -->
    <numero_etapa>16</numero_etapa>
    <nombre_etapa>Cortegana-La Rábida.Palos de la Frontera</nombre_etapa>
    <fecha_etapa>08-09-2026</fecha_etapa>

    <!-- Detalles de la etapa -->
    <datos_etapa>
        <longitud unidades="km">181,1</longitud>
        <tiempo_ganador>3:56:33</tiempo_ganador>
        <velocidad_media unidades="km/h">45,935</velocidad_media>
        <desnivel_acumulado unidades="m">2256</desnivel_acumulado>
        <tipo_etapa>Ondulada</tipo_etapa>
    </datos_etapa>

    <!-- Trayecto y Localizaciones Geográficas (Puntos de Salida y Meta) -->
    <recorrido>
        <lugar_salida>
            <nombre>Cortegana</nombre>
            <georreferenciacion>
                <longitud unidades="grados decimales">-6.837</longitud>
                <latitud unidades="grados decimales">37.915</latitud>
                <altitud unidades="metros">610.0</altitud>
            </georreferenciacion>
        </lugar_salida>
        <lugar_meta>
            <nombre>La Rábida. Palos de la Frontera</nombre>
            <georreferenciacion>
                <longitud unidades="grados decimales">-6.903000</longitud>
                <latitud unidades="grados decimales">37.195000</latitud>
                <altitud unidades="metros">12.0</altitud>
            </georreferenciacion>
        </lugar_meta>
    </recorrido>

    <!-- Hitos importantes de la etapa (Puertos, Sprints) -->
    <hitos_etapa>
        <hito tipo="Puerto de Fuenteheridos (2ª categoría)">
            <georreferenciacion>
                <longitud unidades="grados decimales">-6.700</longitud>
                <latitud unidades="grados decimales">37.900</latitud>
                <altitud unidades="metros">740.0</altitud>
            </georreferenciacion>
            <distancia_salida unidades="km">22.2</distancia_salida>
        </hito>
        <hito tipo="Alto de Aracena (3ª categoría)">
            <georreferenciacion>
                <longitud unidades="grados decimales">-6.560</longitud>
                <latitud unidades="grados decimales">37.890</latitud>
                <altitud unidades="metros">660.0</altitud>
            </georreferenciacion>
            <distancia_salida unidades="km">33.5</distancia_salida>
        </hito>
        <hito tipo="Alto de Minas de Riotinto (4ª categoría)">
            <georreferenciacion>
                <longitud unidades="grados decimales">-6.590</longitud>
                <latitud unidades="grados decimales">37.690</latitud>
                <altitud unidades="metros">410.0</altitud>
            </georreferenciacion>
            <distancia_salida unidades="km">63.5</distancia_salida>
        </hito>
        <hito tipo="Sprint intermedio bonificado (Villarrasa)">
            <georreferenciacion>
                <longitud unidades="grados decimales">-6.879</longitud>
                <latitud unidades="grados decimales">37.458</latitud>
                <altitud unidades="metros">70.0</altitud>
            </georreferenciacion>
            <distancia_salida unidades="km">114.5</distancia_salida>
        </hito>
    </hitos_etapa>

    <!-- Puntos anónimos para mejorar la precisión del trayecto -->
    <puntos_trayecto_anonimos>
        <!-- Tramo hasta Fuenteheridos -->
        <punto_anonimo>
            <georreferenciacion>
                <longitud unidades="grados decimales">-6.800</longitud>
                <latitud unidades="grados decimales">37.910</latitud>
                <altitud unidades="metros">530.0</altitud>
            </georreferenciacion>
            <distancia_salida unidades="km">7.0</distancia_salida>
        </punto_anonimo>
        <punto_anonimo>
            <georreferenciacion>
                <longitud unidades="grados decimales">-6.750</longitud>
                <latitud unidades="grados decimales">37.905</latitud>
                <altitud unidades="metros">680.0</altitud>
            </georreferenciacion>
            <distancia_salida unidades="km">16.0</distancia_salida>
        </punto_anonimo>

        <!-- Tramo Aracena y Minas de Riotinto -->
        <punto_anonimo>
            <georreferenciacion>
                <longitud unidades="grados decimales">-6.650</longitud>
                <latitud unidades="grados decimales">37.895</latitud>
                <altitud unidades="metros">700.0</altitud>
            </georreferenciacion>
            <distancia_salida unidades="km">28.0</distancia_salida>
        </punto_anonimo>
        <punto_anonimo>
            <georreferenciacion>
                <longitud unidades="grados decimales">-6.500</longitud>
                <latitud unidades="grados decimales">37.850</latitud>
                <altitud unidades="metros">550.0</altitud>
            </georreferenciacion>
            <distancia_salida unidades="km">40.0</distancia_salida>
        </punto_anonimo>
        <punto_anonimo>
            <georreferenciacion>
                <longitud unidades="grados decimales">-6.480</longitud>
                <latitud unidades="grados decimales">37.820</latitud>
                <altitud unidades="metros">320.0</altitud>
            </georreferenciacion>
            <distancia_salida unidades="km">47.0</distancia_salida>
        </punto_anonimo>
        <punto_anonimo>
            <georreferenciacion>
                <longitud unidades="grados decimales">-6.520</longitud>
                <latitud unidades="grados decimales">37.780</latitud>
                <altitud unidades="metros">550.0</altitud>
            </georreferenciacion>
            <distancia_salida unidades="km">53.0</distancia_salida>
        </punto_anonimo>
        <punto_anonimo>
            <georreferenciacion>
                <longitud unidades="grados decimales">-6.550</longitud>
                <latitud unidades="grados decimales">37.750</latitud>
                <altitud unidades="metros">380.0</altitud>
            </georreferenciacion>
            <distancia_salida unidades="km">58.0</distancia_salida>
        </punto_anonimo>

        <!-- Caídas abruptas hacia La Palma del Condado -->
        <punto_anonimo>
            <georreferenciacion>
                <longitud unidades="grados decimales">-6.600</longitud>
                <latitud unidades="grados decimales">37.650</latitud>
                <altitud unidades="metros">300.0</altitud>
            </georreferenciacion>
            <distancia_salida unidades="km">68.0</distancia_salida>
        </punto_anonimo>
        <punto_anonimo>
            <georreferenciacion>
                <longitud unidades="grados decimales">-6.610</longitud>
                <latitud unidades="grados decimales">37.600</latitud>
                <altitud unidades="metros">200.0</altitud>
            </georreferenciacion>
            <distancia_salida unidades="km">74.0</distancia_salida>
        </punto_anonimo>
        <punto_anonimo>
            <georreferenciacion>
                <longitud unidades="grados decimales">-6.620</longitud>
                <latitud unidades="grados decimales">37.550</latitud>
                <altitud unidades="metros">350.0</altitud>
            </georreferenciacion>
            <distancia_salida unidades="km">78.0</distancia_salida>
        </punto_anonimo>
        <punto_anonimo>
            <georreferenciacion>
                <longitud unidades="grados decimales">-6.600</longitud>
                <latitud unidades="grados decimales">37.500</latitud>
                <altitud unidades="metros">120.0</altitud>
            </georreferenciacion>
            <distancia_salida unidades="km">85.0</distancia_salida>
        </punto_anonimo>
        <punto_anonimo>
            <georreferenciacion>
                <longitud unidades="grados decimales">-6.580</longitud>
                <latitud unidades="grados decimales">37.450</latitud>
                <altitud unidades="metros">320.0</altitud>
            </georreferenciacion>
            <distancia_salida unidades="km">92.0</distancia_salida>
        </punto_anonimo>
        <punto_anonimo>
            <georreferenciacion>
                <longitud unidades="grados decimales">-6.560</longitud>
                <latitud unidades="grados decimales">37.420</latitud>
                <altitud unidades="metros">110.0</altitud>
            </georreferenciacion>
            <distancia_salida unidades="km">100.0</distancia_salida>
        </punto_anonimo>
        <punto_anonimo>
            <georreferenciacion>
                <longitud unidades="grados decimales">-6.555</longitud>
                <latitud unidades="grados decimales">37.400</latitud>
                <altitud unidades="metros">80.0</altitud>
            </georreferenciacion>
            <distancia_salida unidades="km">105.0</distancia_salida>
        </punto_anonimo>

        <!-- Tramos llanos y repechos finales hacia la meta -->
        <punto_anonimo>
            <georreferenciacion>
                <longitud unidades="grados decimales">-6.850</longitud>
                <latitud unidades="grados decimales">37.400</latitud>
                <altitud unidades="metros">50.0</altitud>
            </georreferenciacion>
            <distancia_salida unidades="km">120.0</distancia_salida>
        </punto_anonimo>
        <punto_anonimo>
            <georreferenciacion>
                <longitud unidades="grados decimales">-6.800</longitud>
                <latitud unidades="grados decimales">37.350</latitud>
                <altitud unidades="metros">15.0</altitud>
            </georreferenciacion>
            <distancia_salida unidades="km">128.0</distancia_salida>
        </punto_anonimo>
        <punto_anonimo>
            <georreferenciacion>
                <longitud unidades="grados decimales">-6.780</longitud>
                <latitud unidades="grados decimales">37.300</latitud>
                <altitud unidades="metros">10.0</altitud>